{
  "schema": "dirichlet_murmuration/1",
  "generated_by": "903175b-dirty",
  "params": {"family": "primitive even/odd Dirichlet characters mod prime N", "statistic": "(log X / X[^delta]) * sum_{N prime} sum_{chi in D_pm(N)} chi(ceil(yX)_p)/tau(chi) (LOP eq 1.1/1.2)", "source": "LOP arXiv:2307.00256, Theorem 1.1", "external_data": "none — computed from scratch (characters, Gauss sums, primes); ARCHITECTURE-M §9 repo-reproducible default (the clean case)", "display_X": 2000, "sharp_delta": 0.7, "geom_c": 2},
  "sharp": {"interval": "sharp", "X": 2000, "param": 0.7, "n_prime_conductors": 25, "chars_even": 26138, "chars_odd": 26163, "points": [{"y": 0.02, "even_re": 0.922113715082, "even_im": 2.73073215526e-16, "odd_re": -1.79233511784e-17, "odd_im": -0.114037003523, "density_even": 0.992114701314, "density_odd_im": -0.125333233564},{"y": 0.04, "even_re": 0.900438203511, "even_im": 2.47433313649e-17, "odd_re": -1.12071313995e-18, "odd_im": -0.229047750994, "density_even": 0.968583161129, "density_odd_im": -0.248689887165},{"y": 0.06, "even_re": 0.862400039121, "even_im": 1.28502227855e-16, "odd_re": 9.65274005123e-17, "odd_im": -0.345595444804, "density_even": 0.929776485888, "density_odd_im": -0.368124552685},{"y": 0.08, "even_re": 0.820060923338, "even_im": 8.92782753392e-17, "odd_re": 7.31641833063e-17, "odd_im": -0.436552719889, "density_even": 0.876306680044, "density_odd_im": -0.481753674102},{"y": 0.1, "even_re": 0.748824453126, "even_im": -5.21260051358e-17, "odd_re": 2.59288192059e-16, "odd_im": -0.549712291282, "density_even": 0.809016994375, "density_odd_im": -0.587785252292},{"y": 0.12, "even_re": 0.696313431389, "even_im": 7.70446210726e-17, "odd_re": 1.23110212501e-16, "odd_im": -0.6147781655, "density_even": 0.728968627421, "density_odd_im": -0.684547105929},{"y": 0.14, "even_re": 0.617604169732, "even_im": 1.48326509995e-16, "odd_re": 1.58609871552e-16, "odd_im": -0.693679548519, "density_even": 0.637423989749, "density_odd_im": -0.770513242776},{"y": 0.16, "even_re": 0.506867486105, "even_im": -6.50527386295e-17, "odd_re": 8.83877491228e-17, "odd_im": -0.778109442243, "density_even": 0.535826794979, "density_odd_im": -0.844327925502},{"y": 0.18, "even_re": 0.419937668675, "even_im": 2.28635554376e-16, "odd_re": 4.26193355612e-17, "odd_im": -0.828138644315, "density_even": 0.425779291565, "density_odd_im": -0.904827052466},{"y": 0.2, "even_re": 0.333333390471, "even_im": 1.33167920356e-16, "odd_re": 5.18802037819e-17, "odd_im": -0.86650886563, "density_even": 0.309016994375, "density_odd_im": -0.951056516295},{"y": 0.22, "even_re": 0.221684203499, "even_im": 1.37342513841e-16, "odd_re": -7.60372384749e-18, "odd_im": -0.901399850685, "density_even": 0.187381314586, "density_odd_im": -0.982287250729},{"y": 0.24, "even_re": 0.101005629814, "even_im": 2.36114362781e-16, "odd_re": 5.19084104947e-17, "odd_im": -0.922574585705, "density_even": 0.0627905195293, "density_odd_im": -0.998026728428},{"y": 0.26, "even_re": 0.0064635760617, "even_im": 3.83031040831e-16, "odd_re": -7.87853782015e-17, "odd_im": -0.927923706095, "density_even": -0.0627905195293, "density_odd_im": -0.998026728428},{"y": 0.28, "even_re": -0.110275389753, "even_im": -2.35163393609e-17, "odd_re": -3.19551833819e-17, "odd_im": -0.921185984936, "density_even": -0.187381314586, "density_odd_im": -0.982287250729},{"y": 0.3, "even_re": -0.214402077404, "even_im": 1.53875677035e-16, "odd_re": -2.04091684765e-16, "odd_im": -0.902471110132, "density_even": -0.309016994375, "density_odd_im": -0.951056516295},{"y": 0.32, "even_re": -0.320933113848, "even_im": -1.42061093929e-16, "odd_re": 4.04685737151e-16, "odd_im": -0.870098862674, "density_even": -0.425779291565, "density_odd_im": -0.904827052466},{"y": 0.34, "even_re": -0.427742961728, "even_im": -7.39580007933e-17, "odd_re": -7.5125557224e-17, "odd_im": -0.822631677238, "density_even": -0.535826794979, "density_odd_im": -0.844327925502},{"y": 0.36, "even_re": -0.53227451833, "even_im": -2.40231535458e-16, "odd_re": 5.29802655786e-17, "odd_im": -0.758917879034, "density_even": -0.637423989749, "density_odd_im": -0.770513242776},{"y": 0.38, "even_re": -0.606748354227, "even_im": -2.11941209966e-16, "odd_re": -6.34651036555e-17, "odd_im": -0.700571654914, "density_even": -0.728968627421, "density_odd_im": -0.684547105929},{"y": 0.4, "even_re": -0.700911523939, "even_im": -2.38902797811e-16, "odd_re": -4.15928126941e-17, "odd_im": -0.605964715401, "density_even": -0.809016994375, "density_odd_im": -0.587785252292},{"y": 0.42, "even_re": -0.774450686798, "even_im": 2.89884416316e-17, "odd_re": 1.28650816788e-16, "odd_im": -0.508185345537, "density_even": -0.876306680044, "density_odd_im": -0.481753674102},{"y": 0.44, "even_re": -0.814267573961, "even_im": -2.53908768987e-16, "odd_re": -6.78008783561e-17, "odd_im": -0.441257099752, "density_even": -0.929776485888, "density_odd_im": -0.368124552685},{"y": 0.46, "even_re": -0.868967587672, "even_im": -7.3800849108e-17, "odd_re": 1.84852691914e-16, "odd_im": -0.319588269057, "density_even": -0.968583161129, "density_odd_im": -0.248689887165},{"y": 0.48, "even_re": -0.899503756617, "even_im": 6.83891897931e-17, "odd_re": -1.90548433121e-16, "odd_im": -0.218482277934, "density_even": -0.992114701314, "density_odd_im": -0.125333233564},{"y": 0.5, "even_re": -0.919606028981, "even_im": -1.68273189121e-17, "odd_re": 2.08250160128e-16, "odd_im": -0.103533910309, "density_even": -1, "density_odd_im": -1.22464679915e-16},{"y": 0.52, "even_re": -0.925153342883, "even_im": -2.62137070045e-16, "odd_re": -1.62984934174e-16, "odd_im": 0.00744274881172, "density_even": -0.992114701314, "density_odd_im": 0.125333233564},{"y": 0.54, "even_re": -0.918063092889, "even_im": 1.09377572929e-16, "odd_re": 8.44831341741e-17, "odd_im": 0.112743928856, "density_even": -0.968583161129, "density_odd_im": 0.248689887165},{"y": 0.56, "even_re": -0.900323681333, "even_im": -5.61797127089e-17, "odd_re": -2.23066743375e-16, "odd_im": 0.21112359021, "density_even": -0.929776485888, "density_odd_im": 0.368124552685},{"y": 0.58, "even_re": -0.868300446074, "even_im": -4.30192664525e-17, "odd_re": -6.76014166017e-17, "odd_im": 0.317437611044, "density_even": -0.876306680044, "density_odd_im": 0.481753674102},{"y": 0.6, "even_re": -0.826288467594, "even_im": -4.62122663342e-16, "odd_re": -2.16546963203e-17, "odd_im": 0.414165973873, "density_even": -0.809016994375, "density_odd_im": 0.587785252292},{"y": 0.62, "even_re": -0.757965158001, "even_im": -4.35645122835e-17, "odd_re": 1.04525010955e-16, "odd_im": 0.528421321248, "density_even": -0.728968627421, "density_odd_im": 0.684547105929},{"y": 0.64, "even_re": -0.699984583849, "even_im": -2.34341369409e-16, "odd_re": -8.88269679354e-17, "odd_im": 0.602801460991, "density_even": -0.637423989749, "density_odd_im": 0.770513242776},{"y": 0.66, "even_re": -0.626615829417, "even_im": 5.36411085627e-17, "odd_re": -4.59205283339e-17, "odd_im": 0.678421670619, "density_even": -0.535826794979, "density_odd_im": 0.844327925502},{"y": 0.68, "even_re": -0.540641073163, "even_im": 6.72931575268e-17, "odd_re": -3.0779064199e-16, "odd_im": 0.748421344649, "density_even": -0.425779291565, "density_odd_im": 0.904827052466},{"y": 0.7, "even_re": -0.427370430028, "even_im": -1.77468577473e-16, "odd_re": 1.53363926675e-17, "odd_im": 0.818045311728, "density_even": -0.309016994375, "density_odd_im": 0.951056516295},{"y": 0.72, "even_re": -0.331347817965, "even_im": 1.37592344725e-16, "odd_re": -1.75717998364e-16, "odd_im": 0.861150008114, "density_even": -0.187381314586, "density_odd_im": 0.982287250729},{"y": 0.74, "even_re": -0.241789943783, "even_im": -5.38184078999e-17, "odd_re": -2.24904209234e-16, "odd_im": 0.890211281886, "density_even": -0.0627905195293, "density_odd_im": 0.998026728428},{"y": 0.76, "even_re": -0.127855028275, "even_im": -2.02927150482e-17, "odd_re": -1.65500872212e-16, "odd_im": 0.913260415448, "density_even": 0.0627905195293, "density_odd_im": 0.998026728428},{"y": 0.78, "even_re": -0.00643437369162, "even_im": -6.93784395041e-17, "odd_re": -1.90371133784e-16, "odd_im": 0.921824218769, "density_even": 0.187381314586, "density_odd_im": 0.982287250729},{"y": 0.8, "even_re": 0.0875138800459, "even_im": -3.8034737359e-16, "odd_re": -1.15566931609e-16, "odd_im": 0.917427589324, "density_even": 0.309016994375, "density_odd_im": 0.951056516295},{"y": 0.82, "even_re": 0.239684067791, "even_im": -6.05033988183e-17, "odd_re": -4.35672825856e-17, "odd_im": 0.889428640471, "density_even": 0.425779291565, "density_odd_im": 0.904827052466},{"y": 0.84, "even_re": 0.334117147009, "even_im": 8.42977757761e-18, "odd_re": 5.97599504612e-17, "odd_im": 0.858116247523, "density_even": 0.535826794979, "density_odd_im": 0.844327925502},{"y": 0.86, "even_re": 0.404878446287, "even_im": 4.00212958417e-17, "odd_re": 9.88202033047e-17, "odd_im": 0.826828021529, "density_even": 0.637423989749, "density_odd_im": 0.770513242776},{"y": 0.88, "even_re": 0.537225337992, "even_im": 1.04314467993e-16, "odd_re": 2.15418694694e-17, "odd_im": 0.747044389085, "density_even": 0.728968627421, "density_odd_im": 0.684547105929},{"y": 0.9, "even_re": 0.589464590775, "even_im": -6.485126211e-17, "odd_re": -3.10112658878e-17, "odd_im": 0.706275591848, "density_even": 0.809016994375, "density_odd_im": 0.587785252292},{"y": 0.92, "even_re": 0.680747336304, "even_im": -1.12206303263e-16, "odd_re": -3.11659998548e-16, "odd_im": 0.618142704259, "density_even": 0.876306680044, "density_odd_im": 0.481753674102},{"y": 0.94, "even_re": 0.752732390559, "even_im": 4.25155751536e-17, "odd_re": -4.16089308157e-17, "odd_im": 0.527422135084, "density_even": 0.929776485888, "density_odd_im": 0.368124552685},{"y": 0.96, "even_re": 0.812698687651, "even_im": 7.45986961254e-17, "odd_re": -2.37903474275e-17, "odd_im": 0.428410784038, "density_even": 0.968583161129, "density_odd_im": 0.248689887165},{"y": 0.98, "even_re": 0.859704077268, "even_im": 4.356587225e-16, "odd_re": -9.4462266187e-18, "